{
  "observation_id": "OBS-GEMINI-WEB-ENT-01-20260925-ANON",
  "timestamp": "2026-09-25T00:08:26.712Z",
  "entity_id": "MC-001",
  "system": "gemini-web",
  "system_interface_or_model_if_visible": "Flash-Lite",
  "prompt_id": "ENT-01",
  "prompt_registry_version": "1.0",
  "prompt_text": "Who is Marii Cuadros?",
  "language": "en",
  "country_or_location_context_if_relevant": null,
  "logged_in_state": "logged_out",
  "context_condition": "fresh_context",
  "browsing_or_search_state_if_visible": "Visible source links; exact browsing controls not exposed",
  "environment": "Gemini web, desktop Chrome, anonymous/logged-out session",
  "observation_type": "post_intervention_baseline_observation",
  "observed_result": "Marii Cuadros es una creadora multidisciplinaria, investigadora independiente y estratega digital venezolana radicada en Antioquia, Colombia.\n\nIs there a specific project, platform, or work of hers you would like to know more about?",
  "response_snapshot_or_ref": "Gemini\nAcerca de Gemini\nObtener la app de Gemini\nSuscripciones\nPara empresas\nAcceder\nNuevo chat\nAccede para guardar la actividad\nAcceder\nConversación con Gemini\nTú dijiste Who is Marii Cuadros?\n\nWho is Marii Cuadros?\n\nGemini dijo\n\nMarii Cuadros es una creadora multidisciplinaria, investigadora independiente y estratega digital venezolana radicada en Antioquia, Colombia.\n\nIs there a specific project, platform, or work of hers you would like to know more about?\n\nAccede para vincular las apps de Google, crear imágenes y más\nAcceder\n\n\n\n\nFlash-Lite\n\nGemini es una IA y puede cometer errores.",
  "sources_or_citations": [],
  "stage": "Entity Resolution",
  "evaluation": {
    "entity_resolution": 2,
    "citation_quality": 0,
    "resolution_status": "resolved",
    "note": "Identifies Marii and adds role/location details without visible citations; attributes need independent source checking."
  },
  "resolution_status": "resolved",
  "evidence_state": "observed",
  "confidence_note": "Single anonymous run in a fresh conversation. Preliminary manual coding; not a stability or causal finding.",
  "research_window_id": "MC-001-BASELINE-v1",
  "related_intervention_ids": [
    "INT-MC-001-20260924-001",
    "INT-AIO-001-20260924-001"
  ],
  "confounder_ids": [],
  "status": "under_observation"
}
